{
  "run_id": "2026-06-21-phase-4-async-substrate-closure",
  "harness_version": "0.2.0",
  "state_schema_version": "0.2.0",
  "status": "completed",
  "track": "Standard",
  "current_workflow": "standard-code-change",
  "owner": "codex",
  "base_commit": "610bcc1",
  "created_at": "2026-06-21T03:30:00Z",
  "updated_at": "2026-06-21T03:30:04Z",
  "external_agents": [
    {
      "name": "generic-cli-agent",
      "role": "async-substrate-smoke",
      "adapter": "generic-cli-agent",
      "adapter_version": "0.1.0",
      "state_access": "none",
      "status": "passed"
    }
  ],
  "evidence": [
    {
      "type": "task",
      "path": "harness/runs/2026-06-21-phase-4-async-substrate-closure/task.md",
      "description": "Phase 4 closure task."
    },
    {
      "type": "triage",
      "path": "harness/runs/2026-06-21-phase-4-async-substrate-closure/triage.md",
      "description": "Phase 4 closure triage."
    },
    {
      "type": "plan",
      "path": "harness/runs/2026-06-21-phase-4-async-substrate-closure/plan.md",
      "description": "Phase 4 closure plan."
    },
    {
      "type": "implementation-plan",
      "path": "docs/superpowers/plans/2026-06-20-phase-4-async-job-substrate-implementation.md",
      "description": "Phase 4 async job substrate implementation plan."
    },
    {
      "type": "agent-job",
      "path": "harness/runs/2026-06-21-phase-4-async-substrate-closure/jobs/phase4-substrate-smoke/job.json",
      "description": "Terminal async job artifact consumed by Codex."
    },
    {
      "type": "agent-result",
      "path": "harness/runs/2026-06-21-phase-4-async-substrate-closure/jobs/phase4-substrate-smoke/output.json",
      "description": "Generic agent result artifact for the terminal async job."
    },
    {
      "type": "aggregation",
      "path": "harness/runs/2026-06-21-phase-4-async-substrate-closure/jobs/aggregation.json",
      "description": "Codex aggregation of async job results."
    },
    {
      "type": "verification",
      "path": "harness/runs/2026-06-21-phase-4-async-substrate-closure/verification.md",
      "description": "Phase 4 closure verification record."
    },
    {
      "type": "review-waiver",
      "path": "harness/runs/2026-06-21-phase-4-async-substrate-closure/review-waiver.md",
      "description": "External review waiver for this closure record."
    },
    {
      "type": "handoff",
      "path": "harness/runs/2026-06-21-phase-4-async-substrate-closure/handoff.md",
      "description": "Phase 4 closure handoff."
    }
  ]
}
