{
  "run_id": "example-fast-doc-change",
  "harness_version": "0.1.0",
  "state_schema_version": "0.1.0",
  "status": "completed",
  "track": "Fast",
  "current_workflow": "fast-doc-change",
  "owner": "codex",
  "base_commit": "0c278ac562dd7de1b552ebc3fb0a2cf6de2ac31e",
  "created_at": "2026-06-18T00:00:00Z",
  "updated_at": "2026-06-18T00:00:00Z",
  "external_agents": [
    {
      "name": "claude-code",
      "role": "reviewer",
      "state_access": "none",
      "status": "not_requested"
    }
  ],
  "evidence": [
    {
      "type": "verification",
      "path": "harness/runs/example-fast-doc-change/verification.md",
      "description": "Fast documentation run verification example."
    },
    {
      "type": "handoff",
      "path": "harness/runs/example-fast-doc-change/handoff.md",
      "description": "Fast documentation run handoff example."
    }
  ]
}
