{
  "run_id": "2026-06-19-v0.2-implementation-plan",
  "harness_version": "0.1.0",
  "state_schema_version": "0.1.0",
  "status": "completed",
  "track": "Standard",
  "current_workflow": "standard-doc-system-change",
  "owner": "codex",
  "base_commit": "9beaa32",
  "created_at": "2026-06-19T07:29:23Z",
  "updated_at": "2026-06-19T07:35:03Z",
  "external_agents": [
    {
      "name": "claude-code",
      "role": "reviewer",
      "adapter": "claude-review",
      "adapter_version": "0.1.0",
      "tool": "claude_review",
      "model": null,
      "model_version": null,
      "cli_version": null,
      "prompt_version": "0.1.0",
      "state_access": "none",
      "status": "not_requested"
    }
  ],
  "evidence": [
    {
      "type": "task",
      "path": "harness/runs/2026-06-19-v0.2-implementation-plan/task.md",
      "description": "Implementation planning task."
    },
    {
      "type": "triage",
      "path": "harness/runs/2026-06-19-v0.2-implementation-plan/triage.md",
      "description": "Standard documentation-system triage."
    },
    {
      "type": "plan",
      "path": "harness/runs/2026-06-19-v0.2-implementation-plan/plan.md",
      "description": "Planning checkpoint execution plan."
    },
    {
      "type": "implementation-plan",
      "path": "docs/superpowers/plans/2026-06-19-v0.2-reviewer-provenance-implementation.md",
      "description": "v0.2 reviewer provenance implementation plan."
    },
    {
      "type": "verification",
      "path": "harness/runs/2026-06-19-v0.2-implementation-plan/verification.md",
      "description": "Planning checkpoint verification commands and results."
    },
    {
      "type": "review",
      "path": "harness/runs/2026-06-19-v0.2-implementation-plan/review.md",
      "description": "Planning checkpoint review handling."
    },
    {
      "type": "handoff",
      "path": "harness/runs/2026-06-19-v0.2-implementation-plan/handoff.md",
      "description": "Planning checkpoint handoff."
    }
  ]
}
