{
  "run_id": "2026-06-21-phase-4-live-generic-agent-smoke",
  "harness_version": "0.2.0",
  "state_schema_version": "0.2.0",
  "status": "completed",
  "track": "Standard",
  "current_workflow": "standard-agent-adapter-change",
  "owner": "codex",
  "base_commit": "825be5c17b029ec544371a9ad6c40ca2d9c5b86e",
  "created_at": "2026-06-21T08:13:33Z",
  "updated_at": "2026-06-21T08:15:59Z",
  "external_agents": [
    {
      "name": "claude-code",
      "role": "reviewer",
      "state_access": "none",
      "status": "not_requested"
    }
  ],
  "evidence": [
    {
      "type": "task",
      "path": "task.md",
      "description": "Task definition."
    },
    {
      "type": "triage",
      "path": "triage.md",
      "description": "Task triage."
    },
    {
      "type": "plan",
      "path": "plan.md",
      "description": "Implementation plan."
    },
    {
      "type": "agent-job",
      "path": "jobs/phase4-live-generic-agent/job.json",
      "description": "Terminal generic-agent job produced by run-generic-agent."
    },
    {
      "type": "agent-result",
      "path": "jobs/phase4-live-generic-agent/output.json",
      "description": "Structured result written by the live generic-agent smoke script."
    },
    {
      "type": "aggregation",
      "path": "jobs/aggregation.json",
      "description": "Codex fan-in aggregation for the live generic-agent job."
    },
    {
      "type": "verification",
      "path": "verification.md",
      "description": "Verification for the live generic-agent smoke run."
    },
    {
      "type": "review-waiver",
      "path": "review-waiver.md",
      "description": "Review waiver for the narrow live generic-agent smoke run."
    },
    {
      "type": "handoff",
      "path": "handoff.md",
      "description": "Handoff for the live generic-agent smoke run."
    }
  ]
}
