{
  "run_id": "2026-06-20-phase-3-review-decision-memory-implementation",
  "harness_version": "0.2.0",
  "state_schema_version": "0.2.0",
  "status": "completed",
  "track": "Standard",
  "current_workflow": "standard-code-change",
  "owner": "codex",
  "base_commit": "d55f17f",
  "created_at": "2026-06-20T12:58:12Z",
  "updated_at": "2026-06-20T14:32:37Z",
  "external_agents": [
    {
      "name": "claude-code",
      "role": "reviewer",
      "state_access": "none",
      "status": "not_requested"
    }
  ],
  "evidence": [
    {
      "type": "task",
      "path": "task.md",
      "description": "Task definition."
    },
    {
      "type": "triage",
      "path": "triage.md",
      "description": "Task triage."
    },
    {
      "type": "plan",
      "path": "plan.md",
      "description": "Implementation plan."
    },
    {
      "type": "implementation-plan",
      "path": "docs/superpowers/plans/2026-06-20-phase-3-review-decision-memory-implementation.md",
      "description": "Phase 3 review decision and memory closure implementation plan."
    },
    {
      "type": "verification",
      "path": "harness/runs/2026-06-20-phase-3-review-decision-memory-implementation/verification.md",
      "description": "Phase 3 verification record."
    },
    {
      "type": "review-output",
      "path": "harness/runs/2026-06-20-phase-3-review-decision-memory-implementation/reviews/claude-review.json",
      "description": "Reviewer output artifact."
    },
    {
      "type": "review-evidence",
      "path": "harness/runs/2026-06-20-phase-3-review-decision-memory-implementation/reviews/review-decision.json",
      "description": "Codex review-decision artifact (Phase 3)."
    },
    {
      "type": "handoff",
      "path": "harness/runs/2026-06-20-phase-3-review-decision-memory-implementation/handoff.md",
      "description": "Phase 3 handoff."
    }
  ]
}
