{
  "run_id": "2026-06-19-standard-adapter-cli",
  "harness_version": "0.1.0",
  "state_schema_version": "0.1.0",
  "status": "completed",
  "track": "Standard",
  "current_workflow": "standard-agent-adapter-change",
  "owner": "codex",
  "base_commit": "f3bb9b9f20b2407cbc7e9487414781b506d161a5",
  "created_at": "2026-06-19T00:00:00Z",
  "updated_at": "2026-06-19T03:22:20Z",
  "external_agents": [
    {
      "name": "claude-code",
      "role": "reviewer",
      "adapter": "claude-review",
      "adapter_version": "0.1.0",
      "tool": "claude_review",
      "model": "unknown",
      "model_version": "unknown",
      "cli_version": "2.1.168",
      "prompt_version": "0.1.0",
      "state_access": "none",
      "status": "findings"
    }
  ],
  "evidence": [
    {
      "type": "task",
      "path": "harness/runs/2026-06-19-standard-adapter-cli/task.md",
      "description": "Standard run task definition."
    },
    {
      "type": "triage",
      "path": "harness/runs/2026-06-19-standard-adapter-cli/triage.md",
      "description": "Standard adapter-change triage."
    },
    {
      "type": "plan",
      "path": "harness/runs/2026-06-19-standard-adapter-cli/plan.md",
      "description": "Execution plan for S1-S4."
    },
    {
      "type": "diff",
      "path": "harness/runs/2026-06-19-standard-adapter-cli/artifacts/diff.patch",
      "description": "Selected-file working-tree diff reviewed by Claude."
    },
    {
      "type": "diff-meta",
      "path": "harness/runs/2026-06-19-standard-adapter-cli/artifacts/diff.meta.json",
      "description": "Diff source metadata."
    },
    {
      "type": "verification",
      "path": "harness/runs/2026-06-19-standard-adapter-cli/verification.md",
      "description": "Verification commands, results, gaps, and residual risks."
    },
    {
      "type": "review",
      "path": "harness/runs/2026-06-19-standard-adapter-cli/reviews/claude-review-final.evidence.json",
      "description": "Final reduced-scope Claude review evidence with no high or medium findings."
    },
    {
      "type": "handoff",
      "path": "harness/runs/2026-06-19-standard-adapter-cli/handoff.md",
      "description": "Completion handoff and next step."
    }
  ]
}
