{
  "run_id": "2026-06-22-phase-5-live-scheduler-smoke",
  "harness_version": "0.2.0",
  "state_schema_version": "0.2.0",
  "status": "completed",
  "track": "Standard",
  "current_workflow": "standard-agent-adapter-change",
  "owner": "codex",
  "base_commit": "HEAD",
  "created_at": "2026-06-21T23:26:53Z",
  "updated_at": "2026-06-22T00:30:18Z",
  "external_agents": [
    {
      "name": "claude-code",
      "role": "reviewer",
      "adapter": "claude-review",
      "adapter_version": "0.1.0",
      "tool": "claude_review",
      "model": "glm-5.2[1m]",
      "model_version": null,
      "cli_version": "2.1.160 (Claude Code)",
      "prompt_version": "0.2.0",
      "state_access": "none",
      "status": "findings"
    }
  ],
  "evidence": [
    {
      "type": "task",
      "path": "task.md",
      "description": "Task definition."
    },
    {
      "type": "triage",
      "path": "triage.md",
      "description": "Task triage."
    },
    {
      "type": "plan",
      "path": "plan.md",
      "description": "Implementation plan."
    },
    {
      "type": "agent-job",
      "path": "jobs/phase5-live-scheduler-agent/job.json",
      "description": "Scheduler-executed generic CLI job process record."
    },
    {
      "type": "agent-result",
      "path": "jobs/phase5-live-scheduler-agent/output.json",
      "description": "Structured result from the scheduler-executed smoke agent."
    },
    {
      "type": "aggregation",
      "path": "jobs/aggregation.json",
      "description": "Aggregation summary for the scheduler-executed smoke job."
    },
    {
      "type": "verification",
      "path": "verification.md",
      "description": "Verification record for the live scheduler smoke run."
    },
    {
      "type": "review-waiver",
      "path": "review-waiver.md",
      "description": "Run-record-only review waiver."
    },
    {
      "type": "handoff",
      "path": "handoff.md",
      "description": "Closure handoff for the live scheduler smoke run."
    },
    {
      "type": "review-output",
      "path": "reviews/phase5-code-review/claude-review.json",
      "description": "External Claude Code review output for Phase 5.2 scheduler code."
    },
    {
      "type": "review-evidence",
      "path": "reviews/phase5-code-review/claude-review.evidence.json",
      "description": "Structured external Claude Code review evidence for Phase 5.2 scheduler code."
    },
    {
      "type": "review-evidence",
      "path": "reviews/phase5-code-review/review-decision.json",
      "description": "Codex review decision triaging external Claude Code findings."
    }
  ]
}
