{
  "run_id": "2026-06-22-phase-6-scheduler-watch-mode",
  "harness_version": "0.2.0",
  "state_schema_version": "0.2.0",
  "status": "completed",
  "track": "Standard",
  "current_workflow": "standard-agent-adapter-change",
  "owner": "codex",
  "base_commit": "HEAD",
  "created_at": "2026-06-22T05:21:18Z",
  "updated_at": "2026-06-22T09:57:46Z",
  "external_agents": [
    {
      "name": "claude-code",
      "role": "reviewer",
      "state_access": "none",
      "status": "not_requested"
    }
  ],
  "evidence": [
    {
      "type": "task",
      "path": "task.md",
      "description": "Task definition."
    },
    {
      "type": "triage",
      "path": "triage.md",
      "description": "Task triage."
    },
    {
      "type": "plan",
      "path": "plan.md",
      "description": "Implementation plan."
    },
    {
      "type": "agent-job",
      "path": "jobs/phase6-watch-agent/job.json",
      "description": "Terminal watch-executed async job consumed by Codex."
    },
    {
      "type": "agent-result",
      "path": "jobs/phase6-watch-agent/output.json",
      "description": "Structured watch-executed agent result consumed by Codex."
    },
    {
      "type": "aggregation",
      "path": "jobs/aggregation.json",
      "description": "Aggregation proving the watch-executed job was consumed."
    },
    {
      "type": "verification",
      "path": "verification.md",
      "description": "Verification record for the Phase 6 scheduler watch smoke run."
    },
    {
      "type": "handoff",
      "path": "handoff.md",
      "description": "Closure handoff for the Phase 6 scheduler watch smoke run."
    },
    {
      "type": "review-waiver",
      "path": "review-waiver.md",
      "description": "Run-record-only review waiver."
    },
    {
      "type": "review-output",
      "path": "reviews/phase6-code-review/claude-review.json",
      "description": "External Claude Code review output for Phase 6 scheduler watch mode."
    },
    {
      "type": "review-evidence",
      "path": "reviews/phase6-code-review/claude-review.evidence.json",
      "description": "Structured external Claude Code review evidence for Phase 6 scheduler watch mode."
    },
    {
      "type": "review-raw-log",
      "path": "reviews/phase6-code-review/claude-review.raw.log",
      "description": "Raw external Claude Code review log for Phase 6 scheduler watch mode."
    },
    {
      "type": "review-evidence",
      "path": "reviews/phase6-code-review/review-decision.json",
      "description": "Codex triage decision for Phase 6 external review findings."
    }
  ]
}
