{
  "run_id": "2026-06-23-phase-9-entry-gate-local-scheduler-closure",
  "harness_version": "0.2.0",
  "state_schema_version": "0.2.0",
  "status": "in_progress",
  "track": "Strict",
  "current_workflow": "strict-risk-change",
  "owner": "codex",
  "base_commit": "00c3b57cc09c9ad4e33a5fe84dab398693e35a4f",
  "created_at": "2026-06-23T00:26:57Z",
  "updated_at": "2026-06-23T00:29:18Z",
  "external_agents": [
    {
      "name": "claude-code",
      "role": "reviewer",
      "state_access": "none",
      "status": "not_requested"
    }
  ],
  "evidence": [
    {
      "type": "task",
      "path": "task.md",
      "description": "Task definition."
    },
    {
      "type": "triage",
      "path": "triage.md",
      "description": "Task triage."
    },
    {
      "type": "plan",
      "path": "plan.md",
      "description": "Implementation plan."
    }
  ]
}
